{
  "description": "Generated valid: PATH flood",
  "tags": [
    "path",
    "flood"
  ],
  "packet_hex": "2184a732ed03a659ab8e622d46c1ff8bc1f4e461c05a284f708d",
  "valid": true,
  "expected": {
    "route_type": "flood",
    "payload_type": "PATH",
    "payload_ver": 0,
    "transport_codes": null,
    "path": {
      "hash_size": 3,
      "hops": [
        "a732ed",
        "03a659",
        "ab8e62",
        "2d46c1"
      ]
    },
    "payload": {
      "dst": "ff",
      "src": "8b",
      "mac": "c1f4",
      "ciphertext_len": 8
    }
  }
}
