{
  "description": "Generated valid: PATH direct",
  "tags": [
    "path",
    "direct"
  ],
  "packet_hex": "2287cb86e8591c703633b236d0769dff13975d9ede886cdd627055f73250c88d77fe9353df7f6d8989bf2c6c7da21695834a12d816",
  "valid": true,
  "expected": {
    "route_type": "direct",
    "payload_type": "PATH",
    "payload_ver": 0,
    "transport_codes": null,
    "path": {
      "hash_size": 3,
      "hops": [
        "cb86e8",
        "591c70",
        "3633b2",
        "36d076",
        "9dff13",
        "975d9e",
        "de886c"
      ]
    },
    "payload": {
      "dst": "dd",
      "src": "62",
      "mac": "7055",
      "ciphertext_len": 26
    }
  }
}
