{
  "description": "Generated valid: ACK flood",
  "tags": [
    "ack",
    "flood"
  ],
  "packet_hex": "0d8948946575d9bc74edfb5f316a6119120c030bd8de6168dde8ce4b806be40000",
  "valid": true,
  "expected": {
    "route_type": "flood",
    "payload_type": "ACK",
    "payload_ver": 0,
    "transport_codes": null,
    "path": {
      "hash_size": 3,
      "hops": [
        "489465",
        "75d9bc",
        "74edfb",
        "5f316a",
        "611912",
        "0c030b",
        "d8de61",
        "68dde8",
        "ce4b80"
      ]
    },
    "payload": {
      "ack_crc": 58475
    }
  }
}
