{
  "description": "Generated valid: ADVERT direct",
  "tags": [
    "advert",
    "direct"
  ],
  "packet_hex": "1289db4080a733da834b5ec916008bd86d5788b4d8f25fbb8e6e46c4dccdc5c6108bf475f6f47fcd88db485f66097cf1aa1d70da833d41ca740b8e300050aa0000892af955d4324b5d3c3a66625bbf47fe1f7c9da1797a50e3ede7e8d417f31613278ea0e82bd847b80abcad6d89066d22d511926e48838cd22211efa2bd63b70b91e3d206036b1546f56454",
  "valid": true,
  "expected": {
    "route_type": "direct",
    "payload_type": "ADVERT",
    "payload_ver": 0,
    "transport_codes": null,
    "path": {
      "hash_size": 3,
      "hops": [
        "db4080",
        "a733da",
        "834b5e",
        "c91600",
        "8bd86d",
        "5788b4",
        "d8f25f",
        "bb8e6e",
        "46c4dc"
      ]
    },
    "payload": {
      "pubkey_prefix": "cdc5c610",
      "timestamp": 43600,
      "advert": {
        "flags": 145,
        "node_type": "chat",
        "location": {
          "lat": 50.7789,
          "lon": -179.9564
        },
        "name": "dT"
      }
    }
  }
}
