{
  "description": "Generated valid: ACK direct",
  "tags": [
    "ack",
    "direct"
  ],
  "packet_hex": "0e818d72ef85515df4",
  "valid": true,
  "expected": {
    "route_type": "direct",
    "payload_type": "ACK",
    "payload_ver": 0,
    "transport_codes": null,
    "path": {
      "hash_size": 3,
      "hops": [
        "8d72ef"
      ]
    },
    "payload": {
      "ack_crc": 4099756421
    }
  }
}
