{
  "description": "Generated valid: ADVERT direct",
  "tags": [
    "advert",
    "direct"
  ],
  "packet_hex": "128a2a7e3d6876945d37580811aefe90f83e5c70c0772ae4f0121dfd79bd168d6cf889dba68d4bd33b124acefc867b9d24381df2a127780e7fe09845f85fd27801000000b6189c5027c7d68815d85cecd9c31277ce823eb3a55b14f1256369f0acf24c5c1bcb5c01146415f1d365ee1b7010c523384f23f924cd0d7a61372041b2bd89ae12ddb5a2fa7011df04",
  "valid": true,
  "expected": {
    "route_type": "direct",
    "payload_type": "ADVERT",
    "payload_ver": 0,
    "transport_codes": null,
    "path": {
      "hash_size": 3,
      "hops": [
        "2a7e3d",
        "687694",
        "5d3758",
        "0811ae",
        "fe90f8",
        "3e5c70",
        "c0772a",
        "e4f012",
        "1dfd79",
        "bd168d"
      ]
    },
    "payload": {
      "pubkey_prefix": "6cf889db",
      "timestamp": 1,
      "advert": {
        "flags": 18,
        "node_type": "repeater",
        "location": {
          "lat": -89.9999,
          "lon": 81.7279
        },
        "name": null
      }
    }
  }
}
