{
  "description": "Generated valid: GRP_TXT direct",
  "tags": [
    "grp_txt",
    "direct"
  ],
  "packet_hex": "164373564b26d18bffdb8d",
  "valid": true,
  "expected": {
    "route_type": "direct",
    "payload_type": "GRP_TXT",
    "payload_ver": 0,
    "transport_codes": null,
    "path": {
      "hash_size": 2,
      "hops": [
        "7356",
        "4b26",
        "d18b"
      ]
    },
    "payload": {
      "channel_hash": "ff",
      "mac": "db8d",
      "ciphertext_len": 0
    }
  }
}
