{
  "description": "Generated valid: ADVERT direct",
  "tags": [
    "advert",
    "direct"
  ],
  "packet_hex": "12024040e6130be985bc72333c4d65534e8b39e941d97bfe4a3d0e9c937db4b067e52d972ea63e8b8f2d279a196f3ee5af46292026eee4de320fee0f85eb02d91a5ed202435e644e5ae41c71e452601b69dd5baebfa1f0d6476d35b18c40c1d53a1e77786b7d121f91553560ff006b45f5646972656374",
  "valid": true,
  "expected": {
    "route_type": "direct",
    "payload_type": "ADVERT",
    "payload_ver": 0,
    "transport_codes": null,
    "path": {
      "hash_size": 1,
      "hops": [
        "40",
        "40"
      ]
    },
    "payload": {
      "pubkey_prefix": "e6130be9",
      "timestamp": 2336138798,
      "advert": {
        "flags": 145,
        "node_type": "chat",
        "location": {
          "lat": -10.4721,
          "lon": -180.0
        },
        "name": "direct"
      }
    }
  }
}
