{
  "description": "Generated valid: ACK direct",
  "tags": [
    "ack",
    "direct"
  ],
  "packet_hex": "0e4a785ce0b0363a99dab99715dd16ceba7aa9fc8e6adc000000",
  "valid": true,
  "expected": {
    "route_type": "direct",
    "payload_type": "ACK",
    "payload_ver": 0,
    "transport_codes": null,
    "path": {
      "hash_size": 2,
      "hops": [
        "785c",
        "e0b0",
        "363a",
        "99da",
        "b997",
        "15dd",
        "16ce",
        "ba7a",
        "a9fc",
        "8e6a"
      ]
    },
    "payload": {
      "ack_crc": 220
    }
  }
}
