{
  "description": "Generated valid: REQ direct",
  "tags": [
    "req",
    "direct"
  ],
  "packet_hex": "02804602d0bb61adf9e400f8e0e71446524661e965d354fabc952a767f791c58f4f57d9ed6",
  "valid": true,
  "expected": {
    "route_type": "direct",
    "payload_type": "REQ",
    "payload_ver": 0,
    "transport_codes": null,
    "path": {
      "hash_size": 3,
      "hops": []
    },
    "payload": {
      "dst": "46",
      "src": "02",
      "mac": "d0bb",
      "ciphertext_len": 31
    }
  }
}
