{
  "description": "Generated valid: PATH flood",
  "tags": [
    "path",
    "flood"
  ],
  "packet_hex": "21061644b07980d81dd5e671b19f86ed4db072af957947a0f5f819e44c94e6d0a0ae65c528a086a265391a0e7add271b",
  "valid": true,
  "expected": {
    "route_type": "flood",
    "payload_type": "PATH",
    "payload_ver": 0,
    "transport_codes": null,
    "path": {
      "hash_size": 1,
      "hops": [
        "16",
        "44",
        "b0",
        "79",
        "80",
        "d8"
      ]
    },
    "payload": {
      "dst": "1d",
      "src": "d5",
      "mac": "e671",
      "ciphertext_len": 36
    }
  }
}
