{
  "description": "Generated valid: ACK direct",
  "tags": [
    "ack",
    "direct"
  ],
  "packet_hex": "0e05925f86562699000000",
  "valid": true,
  "expected": {
    "route_type": "direct",
    "payload_type": "ACK",
    "payload_ver": 0,
    "transport_codes": null,
    "path": {
      "hash_size": 1,
      "hops": [
        "92",
        "5f",
        "86",
        "56",
        "26"
      ]
    },
    "payload": {
      "ack_crc": 153
    }
  }
}
