{
  "description": "Generated valid: ADVERT flood",
  "tags": [
    "advert",
    "flood"
  ],
  "packet_hex": "1188181621a5dfa949595cb105a99fe6cf3ea91c6ca928efde49ebbb7790f85519d9138c64c5cf30e479060410bb2ac268c2adbe1503b9e69f525a5f000004dcbea0a3b7a1af4b89ee72a2f3b50b0707bec5184e0fec403cd443b765d99e183ee7f9b13a1f1fa0c23a18d3f975ba3a882c116fcfb007ee24eff480cecab983314d",
  "valid": true,
  "expected": {
    "route_type": "flood",
    "payload_type": "ADVERT",
    "payload_ver": 0,
    "transport_codes": null,
    "path": {
      "hash_size": 3,
      "hops": [
        "181621",
        "a5dfa9",
        "49595c",
        "b105a9",
        "9fe6cf",
        "3ea91c",
        "6ca928",
        "efde49"
      ]
    },
    "payload": {
      "pubkey_prefix": "ebbb7790",
      "timestamp": 24410,
      "advert": {
        "flags": 131,
        "node_type": "room",
        "location": null,
        "name": "1M"
      }
    }
  }
}
