{
  "description": "Generated valid: ADVERT flood",
  "tags": [
    "advert",
    "flood"
  ],
  "packet_hex": "11460a4f953ab4ef65f9d5955b849078e36213c2522faa76e7d25b40b72f8a326d01b11710c44434da41536b862c44660000e2fd6b9ef4479acadd7ee4585471987c557148fcad10d47bf7d83321f8ea01d60282457ac523e9ead344aa15f8c66e7495451d4cadc914cf00a9d57ee76e27691248b6a2fa006b45f5",
  "valid": true,
  "expected": {
    "route_type": "flood",
    "payload_type": "ADVERT",
    "payload_ver": 0,
    "transport_codes": null,
    "path": {
      "hash_size": 2,
      "hops": [
        "0a4f",
        "953a",
        "b4ef",
        "65f9",
        "d595",
        "5b84"
      ]
    },
    "payload": {
      "pubkey_prefix": "9078e362",
      "timestamp": 26180,
      "advert": {
        "flags": 18,
        "node_type": "repeater",
        "location": {
          "lat": -89.9998,
          "lon": -180.0
        },
        "name": null
      }
    }
  }
}
