{
  "description": "Generated valid: GRP_TXT direct",
  "tags": [
    "grp_txt",
    "direct"
  ],
  "packet_hex": "1642e3e433a9b7c2a7abee93dd1d8e52b7bb2f999438ce281eb0bd46412e5d33ffa34d6468b2",
  "valid": true,
  "expected": {
    "route_type": "direct",
    "payload_type": "GRP_TXT",
    "payload_ver": 0,
    "transport_codes": null,
    "path": {
      "hash_size": 2,
      "hops": [
        "e3e4",
        "33a9"
      ]
    },
    "payload": {
      "channel_hash": "b7",
      "mac": "c2a7",
      "ciphertext_len": 29
    }
  }
}
